File version: 1,Name,Description,Clarification Text,Hidden Stacking Text
BadgeSwap,Badge Swap,"Lets you change badges in battle 4 times. (Equipping or unequipping a badge counts as 1 use). Changing a badge does not cost a turn, but a badge equipped on a single character can only be removed by that character. Badge Swap and the Curse badges can't be changed using this.",,`+4 Uses
SuperCurse,Super Curse,"For players familiar with RPG combat. Increases enemy HP, attack power, exp gain and money gain by 1.33x in most cases. Items drop more often. Enemies and bosses may have changes to their moves. Environmental effects become more severe.",,"Curse levels past 4x do not stack linearly. (4x, 5.33x, 6x, 8x, 10.66x, 12x, 16x)"
UltraCurse,Ultra Curse,"For expert players not intimidated by strong enemies. Increases enemy HP, attack power, exp gain and money gain by 1.5x in most cases. Item drops become guaranteed. Enemies and bosses may have changes to their moves. Environmental effects become more severe.",Same as Super Curse but with higher stats.,"Curse levels past 4x do not stack linearly. (4x, 5.33x, 6x, 8x, 10.66x, 12x, 16x)"
MegaCurse,Mega Curse,"For dauntless players wishing to push the limits of what's possible. Increases enemy HP, attack power, exp gain and money gain by 2.0x in most cases. Item drops become guaranteed. Enemies and bosses may have changes to their moves. Environmental effects become more severe.",Same as Super Curse but with higher stats. Don't equip this unless you know what you're doing!,"Curse levels past 4x do not stack linearly. (4x, 5.33x, 6x, 8x, 10.66x, 12x, 16x)"
Focus,Focus A,Gives Wilex access to the move Focus or an upgraded form of it. (L2: Gives 3 Focus.) (L3: Gives 6 Focus.),,"Higher levels: +3 cost, +2 Focus applied."
FocusB,Focus B,Gives Wilex access to the move Focus or an upgraded form of it. (L2: Gives 3 Focus.) (L3: Gives 6 Focus.),,"Higher levels: +3 cost, +2 Focus applied."
MultiStomp,Multi Stomp,Gives Wilex access to the move Multistomp. Multistomp allows you to attack enemies in a row.,,"Higher levels: +3 cost, +2 damage dealt."
ElectroStomp,Electro Stomp,"Gives Wilex access to the move Electro Stomp or an upgraded form of it. (L2: Bonus damage against targets with defense, decreases target defense (2/3t))",,"Higher levels: +4 cost, +2 more base damage, +2 defense down potency applied."
Taunt,Taunt,Gives Wilex access to the move Taunt. Taunt will inflict Berserk onto all enemies and makes them target the user for the duration of the effect.,,"Higher levels: +3 cost, +2 turns of Berserk applied."
ParalyzeStomp,Paralyze Stomp,Gives Wilex access to the move Paralyze Stomp. Paralyze Stomp deals Electric damage and can paralyze enemies for 2 turns. Paralyzing enemies will halve their attack power.,,"Higher levels: +3 cost, +2 turns of Paralyze applied."
FlameStomp,Flame Stomp,Gives Wilex access to the move Flame Stomp or an upgraded form of it. (L2: Inflicts 4 Sunder at the end of turn.),,"Higher levels: +4 cost, +2 more base damage, +2 Sunder applied."
DoubleStomp,Double Stomp,"Gives Wilex access to the move Double Stomp or an upgraded form of it. (L2: Hits 3 times, though the third hit is only 0.75x as strong as the second hit.)",,"Higher levels: +3 cost, +1 additional hit."
Overstomp,Overstomp,"Gives Wilex access to the move Overstomp. Overstomp deals damage equal to your base stomp damage + 12, but has recoil damage equal to your base stomp damage.",,"Higher levels: +3 cost, +5 damage dealt, +3 recoil damage."
SmartStomp,Smart Stomp,"Gives Wilex access to the move Smart Stomp. Smart Stomp will attempt to inflict the status the target is weakest to, the one with the longest duration of the statuses that work.",,"Higher levels: +3 cost, +2 turns of status applied."
TeamQuake,Team Quake,Gives Wilex access to the move Team Quake or an upgraded form of it. (L2: Hits all enemies 5 times with the same falloff.),,"Higher levels: +5 cost, +2 hits."
MultiSlash,Multi Slash A,Gives Wilex access to the move Multislash or an upgraded form of it. (L2: Hits 4 times at +3 cost.) (L3: Hits 6 times at +3 cost.),,"Higher levels: +3 cost, +2 hits."
MultiSlashB,Multi Slash B,Gives Wilex access to the move Multislash or an upgraded form of it. (L2: Hits 4 times at +3 cost.) (L3: Hits 6 times at +3 cost.),,"Higher levels: +3 cost, +2 hits."
SlipSlash,Slip Slash,"Gives Wilex access to the move Slip Slash or an upgraded form of it. (L2: +3 cost, but does 1 more damage to bypassed enemies and 2 more damage to the target.)",,"Higher levels: +3 cost, +1 damage to bypassed enemies and +2 damage to the target."
PoisonSlash,Poison Slash,"Gives Wilex access to the move Poison Slash. Poison Slash can poison enemies for 2 turns. Poisoned enemies take damage equal to 10% of their max hp, clamped between 2 and 10 damage.",,"Higher levels: +2 cost, +2 turns of Poison applied."
PreciseStab,Precise Stab,Gives Wilex access to the move Precise Stab or an upgraded form of it. (L2: Gets an extra boost if you haven't dealt damage last turn.),,"Higher levels: +3 cost, +2 base damage dealt."
SwordDischarge,Sword Discharge,Gives Wilex access to the move Sword Discharge. Sword Discharge can hit an enemy in any position with electric damage.,,"Higher levels: +4 cost, +4 damage dealt."
SwordDance,Sword Dance,Gives Wilex access to the move Sword Dance. Sword Dance allows you to attack any grounded enemy while preserving Focus and giving you some Focus as well. It also swaps your position.,,"Higher levels: +4 cost, +3 damage dealt. +2 Focus received."
BoomerangSlash,Boomerang Slash,Gives Wilex access to the move Boomerang Slash. Boomerang Slash can hit an enemy in any position twice.,,"Higher levels: +4 cost, +2 more base damage for both hits."
Aetherize,Aetherize,"Gives Wilex access to the move Aetherize or an upgraded form of it. (L2: Targets both.) (L3: Targets both, does not inflict Cooldown.)",,"Higher levels: +6 cost, +1 turn of Ethereal applied."
DarkSlash,Dark Slash,Gives Wilex access to the move Dark Slash or an upgraded form of it. (L2: Bonus damage is based on difference in HP percentages between user and target.),,"Higher levels: +6 cost, +3 base damage dealt."
FlameBat,Flame Bat,"Gives Wilex access to the move Flame Bat. (Slash - 3 damage to anything, gives back turn if success)",,"Higher levels: +3 cost, +2 base damage dealt."
AstralWall,Astral Wall,"Gives Wilex access to the move Astral Wall. (Caps incoming damage to 1/4 max hp per turn, but if you take damage it gets removed when your turn starts)",,"Higher levels: +2 cost, Damage cap changes to 1 / (1 + level)"
Brace,Brace A,"Gives Luna access to the move Brace or an upgraded form of it. (L2 = 3 absorb, L3 = 6 absorb)",,"Higher levels: +3 cost, +2 Absorb applied."
BraceB,Brace B,"Gives Luna access to the move Brace or an upgraded form of it. (L2 = 3 absorb, L3 = 6 absorb)",,"Higher levels: +3 cost, +2 Absorb applied."
DashThrough,Dash Through,Gives Luna access to the move Dash Through or an upgraded form of it. L2 ignores hazards (increases damage per enemies hit through to full jump damage),,"Higher levels: +3 cost, +2 damage dealt."
FlipKick,Flip Kick,Gives Luna access to the move Flip Kick. (omni target jump move with stomp damage),,"Higher levels: +4 cost, +4 damage dealt."
FluffHeal,Fluff Heal,Gives Luna access to the move Fluff Heal. (3hp/3t if successful action command),,"Higher levels: +4 cost, +2 more HP healed per turn."
SleepStomp,Sleep Stomp,Gives Luna access to the move Sleep Stomp. (2t sleep inflict with stomp damage),,"Higher levels: +3 cost, +2 turns of Sleep applied."
MeteorStomp,Meteor Stomp,Gives Luna access to the move Meteor Stomp or an upgraded form of it. Inflicts defocus (causes debuffs to act like buffs?),,"Higher levels: +4 cost, +2 more base damage, +2 attack down potency applied."
UnderStrike,Under Strike,"Gives Luna access to the move Under Strike or an upgraded form of it. More hits? (hits twice but second hit is half strength, 6 defocus)",,"Higher levels: +4 cost, +2 more base damage for both hits, defocus applied is equal to 3x level."
IronStomp,Iron Stomp,Gives Luna access to the move Iron Stomp. (stomp + 4 + (defense)),,"Higher levels: +4 cost, damage increases by 1, damage boost given by defense is doubled."
ElementalStomp,Elemental Stomp,"Gives Luna access to the move Elemental Stomp. (Chooses best element to use, stomp damage base?)",,"Higher levels: +5 cost, Each level adds an additional element to damage dealt."
TeamThrow,Team Throw,Gives Luna access to the move Team Throw or an upgraded form of it. More damage (+6),,"Higher levels: +6 cost, +8 damage dealt."
PowerSmash,Power Smash A,Gives Luna access to the move Power Smash or an upgraded form of it. More damage (5 more damage for +3 cost),,"Higher levels: +3 cost, +4 damage dealt."
PowerSmashB,Power Smash B,Gives Luna access to the move Power Smash or an upgraded form of it. More damage (5 more damage for +3 cost),,"Higher levels: +3 cost, +4 damage dealt."
DazzleSmash,Dazzle Smash,Gives Luna access to the move Dazzle Smash. (2t dizzy inflict with smash damage),,"Higher levels: +2 cost, +2 turns of Dizzy applied."
HammerThrow,Hammer Throw,Gives Luna access to the move Hammer Throw or an upgraded form of it. More damage,,"Higher levels: +4 cost, +4 damage dealt."
BreakerSmash,Breaker Smash,Gives Luna access to the move Breaker Smash or an upgraded form of it. Damage boost based on number of hits taken this turn,,"Higher levels: +3 cost, +2 base damage dealt."
FlameSmash,Flame Smash,Gives Luna access to the move Flame Smash or an upgraded form of it. Unlocks the move - (fire element smash),,"Higher levels: +3 cost, +3 base damage dealt."
MomentumSmash,Momentum Smash,Gives Luna access to the move Momentum Smash. Unlocks the move - (hits enemies into behind),,"Higher levels: +4 cost, +2 damage dealt. +1 absorb received."
QuakeSmash,Quake Smash,Gives Luna access to the move Quake Smash. Unlocks the move - (smash damage to all grounded),,"Higher levels: +4 cost, +2 base damage dealt."
Illuminate,Illuminate,Gives Luna access to the move Illuminate or an upgraded form of it. Unlocks L3,,"Higher levels: +3 cost, +2 turns of Illuminate and Parry Aura applied."
LightSmash,Light Smash,Gives Luna access to the move Light Smash or an upgraded form of it. Changes formula (based on similar hp proportion),,"Higher levels: +6 cost, +3 base damage dealt."
HammerBeat,Hammer Beat,Gives Luna access to the move Hammer Beat. Unlocks the move (4 hp recovery also gives action back if successful),,"Higher levels: +3 cost, +3 hp healed and +1 Focus applied."
MistWall,Mist Wall,Gives Luna access to the move Mist Wall. Unlocks the move - (+1 resistance for 3 turns),,"Higher levels: +4 cost, +1 potency for Mist Wall."
StrangeEgg,Strange Egg,Unlocks strange egg based moves for both characters.,Eggs produced by these moves will disappear from your inventory at the end of battle. Eggs produced by these moves do not count for Item Saver.,"Higher levels: Double Egg costs 3 more and produces 1 more egg, Egg Toss costs 2 more and produces 1 more egg that is used immediately."
StatusRelay,Status Relay,"Allows you to take the action ""Status Relay"", which will transfer most effects to the other character.",,
VoraciousEater,Voracious Eater,"The user can't use items, but items are 33% more effective when used on them.",,
MultiSupply,Multi Supply,"Allows you to use the item move Multi Supply 2 times per battle, which lets you use three items in the same turn.",,`+2 uses
QuickSupply,Quick Supply,"Allows you to use the item move Quick Supply 2 times per battle, which lets you use an item then do another action.",,`+2 uses
VoidSupply,Void Supply,"Allows you to use the item move Void Supply 2 times per battle, which lets you use an item that was already used earlier in that battle.",,`+2 uses
ItemBoost,Item Boost,Items used by the user are 33% stronger.,,
ItemSaver,Item Saver,"When the character uses 2 items, they get a freebie, which causes the next item used to not be removed from your inventory.",Items that produce other items will produce nothing if they are a freebie.) (Void Bite does not count for item uses.,Freebie potency increases by 1 per badge equipped.
HPPlus,HP Plus A,Increases your Max HP by 6.,,
HPPlusB,HP Plus B,Increases your Max HP by 6.,,
HPPlusC,HP Plus C,Increases your Max HP by 6.,,
HPPlusD,HP Plus D,Increases your Max HP by 6.,,
EPPlus,EP Plus A,Increases your Max EP by 6.,,
EPPlusB,EP Plus B,Increases your Max EP by 6.,,
EPPlusC,EP Plus C,Increases your Max EP by 6.,,
EPPlusD,EP Plus D,Increases your Max EP by 6.,,
SEPlus,SE Plus A,Increases your Max SE by 6.,,
SEPlusB,SE Plus B,Increases your Max SE by 6.,,
LastCounter,Last Counter,"When you die, the attacker takes damage equal to your hp before getting hit.",,
LastChance,Last Chance,"Allows you to survive one lethal hit, with the damage from the lethal hit being reduced to 0. (1/battle)",,Gives you additional uses of this badge.
LastBurst,Last Burst,"When you die, you recover energy equal to half of your max EP.",,
RiskyPower,Risky Power,"When you are at low HP, your Attack is increased by 2.",,
RiskyShield,Risky Shield,"When you are at low HP, you gain 50% resistance to damage.",,
RiskyEndurance,Risky Endurance,"When you are at low HP, your Endurance is increased by 1. (Endurance reduces energy costs.)",,
ProtectivePower,Protective Power,"When the other character is at low hp, your Attack is increased by 1.",,
ProtectiveShield,Protective Shield,"When the other character is at low hp, you gain 33% resistance to damage.",,
ProtectiveEndurance,Protective Endurance,"When the other character is at low hp, your Endurance is increased by 1. (Endurance reduces energy costs.)",,
PerfectPower,Perfect Power,"When you are at Max HP, your Attack is increased by 2.",,
PerfectShield,Perfect Shield,"When you are at Max HP, you gain 50% resistance to damage.",,
PerfectEndurance,Perfect Endurance,"When you are at Max HP, your Endurance is increased by 1.",,
FirstPower,First Power,"At the start of battle, you gain 3 Focus. (Focus increases your Attack for your next attacking move.)",,
FirstShield,First Shield,"At the start of battle, you gain 3 Absorb. (Absorb increases your Defense for the next enemy attack.)",,
FirstEndurance,First Endurance,"At the start of battle, you gain 3 Burst. (Burst increases your Endurance for the next energy move you use.)",,
EnergeticPower,Energetic Power,"When you are at Max EP, your Attack is increased by 2.",,
EnergyShield,Energy Shield,"You gain 50% resistance to damage at the cost of EP. (2 EP per 1 damage taken). If you don't have enough energy, this badge becomes inactive.",,
EnergyBurst,Energy Burst,"When you are at Max EP, your Endurance is increased by 3. (Endurance reduces energy costs.)",,
AgilePower,Agile Power,"When you are at Max Stamina, your Attack is increased by 2.",,
AgileShield,Agile Shield,"When you are at Max Stamina, you gain 50% resistance to damage.",,
AgileEndurance,Agile Endurance,"When you are at Max Stamina, your Endurance is increased by 3.",,
SpiritPower,Spirit Power,"Your Attack is increased by 1 at the cost of 3 SE per hit. If you don't have enough SE, your Attack is decreased instead.",,
SpiritShield,Spirit Shield,"You gain 50% resistance to damage at the cost of SE. (2 SE per 1 damage taken). If you don't have enough SE, this badge becomes inactive.",,
SpiritFlow,Spirit Flow,The cost of soul moves are decreased by 3 for this character.,,
GoldenPower,Golden Power,"Your Attack is increased by 1 at the cost of 10 coins per hit. If you don't have enough coins, your Attack is decreased instead.",,
GoldenShield,Golden Shield,"You gain 50% resistance to damage at the cost of coins. (10 coins per 1 damage taken). If you don't have enough coins, this badge becomes inactive.",,
Refund,Refund,Using items will give you coins equal to 75% of the item's selling price.,,
DarkPower,Dark Power,"When your SE is at or below 1/3 of your Max SE, your Attack is increased by 1.",,
DarkShield,Dark Shield,"When your SE is at or below 1/3 of your Max SE, you gain 33% resistance to damage.",,
DarkEndurance,Dark Endurance,Your Endurance is increased by 1 but Soul Moves cost twice as much as they do normally. (Endurance reduces energy costs.),,
NullPower,Null Power,"When you are at or below 6 EP, your Attack is increased by 1.",,
NullShield,Null Shield,"When you are at or below 6 EP, you gain 33% resistance to damage.",,Resistance does not stack linearly.
NullEndurance,Null Endurance,"When you are at or below 6 EP, the energy costs of moves are reduced by half (after all other reductions).",,
AttackBoost,Attack Boost A,Increases your Attack by 1.,,
AttackBoostB,Attack Boost B,Increases your Attack by 1.,,
DefenseBoost,Defense Boost A,Increases your Defense by 1.,,
DefenseBoostB,Defense Boost B,Increases your Defense by 1.,,
EnduranceBoost,Endurance Boost A,Increases your Endurance by 1. (Endurance reduces energy costs.),,
EnduranceBoostB,Endurance Boost B,Increases your Endurance by 1. (Endurance reduces energy costs.),,
AgilityBoost,Agility Boost A,Increases your Agility by 2.,,
AgilityBoostB,Agility Boost B,Increases your Agility by 2.,,
VitalEnergy,Vital Energy,Use HP instead of energy (1 to 1 but costs are -1),,No additional effect when stacked.
SoulfulEnergy,Soulful Energy,Use SE instead of energy (1 to 1 but costs are -1),,No additional effect when stacked.
StaminaEnergy,Stamina Energy,Use stamina instead of energy (at quadruple cost),,No additional effect when stacked.
GoldenEnergy,Golden Energy,Use coins instead of energy at a rate of 5 coins per ep (Stamina costs are normal),,No additional effect when stacked.
EnergeticSoul,Energetic Soul,Allows you to pay for soul moves using energy (Costs are 1 ep to 2 se but don't cost stamina),,No additional effect when stacked.
HealthyExercise,Healthy Exercise,Get 1 hp for every 6 stamina used (rounded up),,
SoftPower,Soft Power,"Increases your Attack by 1, but you can't use weapon moves (If Metal Power is also equipped on this character, you regenerate 2 hp per turn.)",,
MetalPower,Metal Power,"Increases your Attack by 1, but you can't use jump moves (If Soft Power is also equipped on this character, your Defense is increased by 2.)",,
AttackFormation,Attack Formation,"The character in the front gains 1 Attack and loses 1 Defense. The character in the back gains 1 Defense and loses 1 Attack. (If combined with Defense Formation, the changes to defense are removed, and the changes to attack are +2 and -2 instead.)",,
DefenseFormation,Defense Formation,"The character in the front gains 1 Defense and loses 1 Attack. The character in the back gains 1 Attack and loses 1 Defense. (If combined with Attack Formation, the changes to attack are removed, and the changes to defense are +2 and -2 instead.)",,
MagicClock,Magic Clock,"Over the course of 4 turns, this badge cycles between increasing Attack by 2, increasing Defense by 2, decreasing Attack by 2, and decreasing Defense by 2.",,
PowerGear,Power Gear,"For every 4th hit, your Attack is increased by 3, but your Attack is decreased by 1 for the other 3 hits.",,
ShieldGear,Shield Gear,"For every 4th hit taken, your Defense is increased by 3, but your Defense is decreased by 1 for the other 3 hits taken.",,
EnergyGear,Energy Gear,"For every 4th energy costing move used, your Endurance is increased by 3, but your Endurance is decreased by 1 for the other 3 moves. (Endurance reduces energy costs.) (0 cost moves will be unaffected)",,
PowerMomentum,Power Momentum,"Exhaustion penalty is doubled (from 25% per action taken to 50% per action taken), but your Attack is increased by 2 for every action taken after the first. (The second action has 2 more Attack)",,
TenaciousStrikes,Tenacious Strikes,Enemies can no longer be immune to damage from your attacks under almost every circumstance. (Minimum damage for every hit is 1),,No additional effect when stacked.
HealthGrowth,Health Growth,Every turn at max health makes you get 2 absorb,,
EnergyGrowth,Energy Growth,Every turn at max energy makes you get 2 burst,,
HealthRegen,Health Regen A,You regenerate 1 HP every turn.,,
HealthRegenB,Health Regen B,You regenerate 1 HP every turn.,,
EnergyRegen,Energy Regen A,You regenerate 1 EP every turn.,,
EnergyRegenB,Energy Regen B,You regenerate 1 EP every turn.,,
SoulRegen,Soul Regen,Increases SE regen rate by 2 per turn.,,
HealthBalance,Health Balance,"Every turn, the character with a higher health percentage loses some HP, while the character with a lower health percentage gains some HP. (Up to 5hp per turn, until health percentages are equalized.)",,Increases the HP that is healed or removed.
EffectBoost,Effect Boost,"Increases the turn count of effects you inflict on enemies by 50%. This includes statuses, but this does not circumvent the status turn limit.",,
StatusBoost,Status Boost,Increases the status susceptibility threshold by 50%. (i.e. you can inflict statuses with enemies at higher HP.),,
StatusConversion,Status Conversion,Increases the status susceptibility threshold by 50% if the enemy already has a status. (i.e. you can inflict statuses with enemies at higher HP.),,
StatusCatalyst,Status Catalyst,"Certain damage types and status combinations will cause the status durations to increase by 1 turn (1/battle for each enemy) (Light <rarrow> Freeze, Water <rarrow> Sleep, Air <rarrow> Paralyze, Dark <rarrow> Poison, Fire <rarrow> Berserk, Earth <rarrow> Dizzy)",,No additional effect when stacked.
StatusExploit,Status Exploit,"Certain damage types do 50% more damage against certain statused targets. (Light <rarrow> Dizzy, Water <rarrow> Paralyze, Air <rarrow> Poison, Dark <rarrow> Sleep, Fire <rarrow> Berserk, Earth <rarrow> Freeze)",,No additional effect when stacked.
Instinct,Instinct,Attacks hit while dizzy at 50% attack power,,No additional effect when stacked.
DizzyMomentum,Dizzy Momentum,Energy costs are halved,,
Trance,Trance,5% se regen per turn (rounds up),,
DizzyAgility,Dizzy Agility,Agility is 50% higher,,
HypnoStrike,Hypno Strike,Attacking a dizzy target inflicts 1 Defocus per hit,,No additional effect when stacked.
UnsteadyStance,Unsteady Stance,"Get 2t dizzy (*since dizzy ticks down right after you use turn relay and so 2t needed to actually matter) whenever you use turn relay, but it gives the target 1 turn worth of stamina",,
Capacitor,Capacitor,2 focus per turn,,
Resistor,Resistor,33% resistance to damage,,Resistance does not stack linearly.
Generator,Generator,5% ep per turn (rounds up),,
Inductor,Inductor,"While paralyzed, enemies take 3 electric contact hazard damage from you if they use a contact attack.",,
Conductor,Conductor,"When you attack a paralyzed target, get 1 focus at end of turn",,
Overexert,Overexert,"Get 2t paralyze every time you attack, but +3 attack. If you don't receive the paralyze, you get 3 defocus instead.",,
Sleepwalk,Sleepwalk,Attack with berserk rules at 50% power,,No additional effect when stacked.
DeepSleep,Deep Sleep,Can't get hit out of sleep but heal 20% max hp (min 4) per turn,,
SweetDreams,Sweet Dreams,Sleep heals energy instead of hp,,No additional effect when stacked.
LightSleep,Light Sleep,Auto block when asleep,,No additional effect when stacked.
NightmareStrike,Nightmare Strike,Deal +50% damage and inflict 3 defocus when you wake up a target,,No additional effect when stacked.
QuickNap,Quick Nap,Start battle 2t asleep (*if you first strike the sleep turn happens after that),,Sleep potency increases by 1 for each badge equipped.
RagesPower,Rage's Power,Permanent berserker but +2 atk,,
RageShield,Rage Shield,"Take 50% damage from contact hazards, removes -1 defense penalty",,"Defense increases by 1 for each badge equipped, resistance to contact hazards increases as well."
RageRally,Rage Rally,Other character gets a +1 attack boost,,
UndyingRage,Undying Rage,Survive 1 lethal hit per battle while berserk,,Gives you an additional use of the badge per battle.
Aggravate,Aggravate,Hits against berserk enemies do +50% damage but apply 3 focus,,No additional effect when stacked.
VengefulRage,Vengeful Rage,Get 2t berserk and 3 focus when the other character dies,,Focus is increased with each additional badge equipped.
ToxicStrength,Toxic Strength,"2 attack when poisoned, but get 2 sunder per turn",,
ToxicShield,Toxic Shield,"2 defense when poisoned, but get 1 defocus when hit",,
ToxicEnergy,Toxic Energy,"Receive 3 energy per turn, but also increases poison damage by 50%",,
ToxicResistance,Toxic Resistance,"Poison causes you to lose energy instead of health, if you have energy.",,No additional effect when stacked.
NerveStrike,Nerve Strike,"When you attack a poisoned enemy, inflict +2 sunder per hit",,
WeakStomach,Weak Stomach,Get 2t poison when an item is used on the user (but items that aren't normally heal over time give you 20% healing over 2 turns),,Get 2 additional turns of poison and heal over time per badge equipped.
FrostEdge,Frost Edge,3 light damage contact hazard,,
IceShell,Ice Shell,+2 defense while frozen,,
Glacier,Glacier,"Getting hit no longer unfreezes, get +2 absorb per turn",,
Preservative,Preservative,Effect turn durations will not tick down from 1 to 0 while frozen (Does not apply to the Effect Stasis effect),,No additional effect when stacked.
Icebreaker,Icebreaker,"Getting unfrozen (by getting hit) gives you 3 focus, +50% damage when unfreezing targets",,
Supercooled,Supercooled,Get 2t frozen every time you get hit while unfrozen but +2 defense (*note: when frozen this is effectively only a +1),,
HealthSight,Health Sight,Reveals enemy health even if you haven't tattled the enemy yet.,,No additional effect when stacked.
DefenseSight,Defense Sight,Reveals enemy defense. (when their health bars are displayed),,No additional effect when stacked.
StatusSight,Status Sight,Reveals information about enemy status weaknesses (when you select the move and hover over an enemy),,No additional effect when stacked.
