File version: 1,Name,Description,Clarification Text,Hidden Stacking Text
CharmSight,Charm Sight,Reveals information about your currently active charms.,,No additional effect when stacked.
PowerSight,Power Sight,Reveals information about the attack power of your moves.,,No additional effect when stacked.
ItemSight,Item Sight,Reveals information about what effects your items will have.,,No additional effect when stacked.
BattleSight,Battle Sight,"Reveals various statistics about your time in battle. (Turn count, damage dealt, number of hits, items used)",,No additional effect when stacked.
SoftTouch,Soft Touch,"No longer wake enemies on hit or break freeze, half damage from contact hazards in general",,No additional effect when stacked.
PerfectVictory,Perfect Victory,"If you defeat all enemies with perfect damage, XP gained is multiplied by 1.5x at the end of battle.",,Multiplier increases by 0.5 for each badge equipped.
DecisiveVictory,Decisive Victory,Defeating a battle in one turn doubles exp and money gain.,,Multiplier increases by 1 for each badge equipped.
StatusResist,Status Resist A,Most negative effects last half as long (Blocking will negate status infliction),,
StatusResistB,Status Resist B,Most negative effects last half as long (Blocking will negate status infliction),,
CharmBoost,Charm Boost,Increases the strength of Power charm effects. (+3 <rarrow> +5),,Power increases by 2 for each badge equipped.
RibbonPower,Ribbon Power,Ribbon rest effects are tripled but you also gain statuses or other negative effects,,"Positive effect multiplier increases by 3 for each badge equipped, negative effect multiplier increases by 1."
RibbonSwap,Ribbon Swap,Allows you to change ribbons in battle. Changing ribbons does not take up your turn. Only the character wearing a ribbon can remove it from themselves.,,No additional effect when stacked.
LongRest,Long Rest,"Inn rest effects are 50% stronger, Effects for using Rest are 50% stronger if you rest last turn",,
HealthSteal,Health Steal,"Attacks siphon a small amount of HP, but -1 atk (1/hit)",,
EnergySteal,Energy Steal,"Attacks siphon a small amount of EP, but -1 atk (1/hit)",,
RiskyRush,Risky Rush,3 focus when you take damage that puts you in danger range (or at exactly 1 hp),,
ProtectiveRush,Protective Rush,Focus when ally is hit (1/enemy turn),,Increases the focus amount received.
PerfectFocus,Perfect Focus,Healing to max gives you 3 focus,,
HeadStart,Head Start,Gives you another action at the start of battle and you get 50% more stamina on the first turn.,,
RiskyStart,Risky Start,Start battle at low hp (lowers your hp),,Wearing 2 or more will cause you to start at 1 hp.
VictoryHeal,Victory Heal,Get 3 health at the end of battle,,
VictorySurge,Victory Surge,Get 3 energy at the end of battle,,
AgilityRush,Agility Rush,Reaching max stamina gives you an extra turn (1/battle),,Each additional badge gives you an extra use per battle.
StaminaRebound,Stamina Rebound,"When you reach exactly 0 stamina after using a move, you get stamina equal to half your agility.",,
MoneyBoost,Money Boost,Boosts coin drops,,
DarkConcentration,Dark Concentration,SE regen per turn is removed but Rest gives 3 more SE,,
DepletionBurst,Depletion Burst,Getting to 0 energy by using a move gives you 5 energy,,
RevivalFlame,Revival Flame,"(1/battle) When you die to an attack by an enemy with higher max HP than you, you will be restored to max HP and gain 6 focus",,Each additional badge gives you an extra use per battle.
DeathSwap,Death Swap,"If this character would die (and the other character is alive), the other character dies instead",,No additional effect when stacked.
SkillSwap,Skill Swap,User can use abilities from the other character at 1.5x cost,,No additional effect when stacked.
FocusRecycling,Focus Recycling,Save half focus when used,,Save (1 - (1 / badges equipped)) focus instead
AbsorbRecycling,Absorb Recycling,Save half absorb when used,,Save (1 - (1 / badges equipped)) absorb instead
BurstRecycling,Burst Recycling,Save half burst when used,,Save (1 - (1 / badges equipped)) burst instead
StaminaRecycling,Stamina Recycling,Saves half stamina when used,,Save (1 - (1 / badges equipped)) stamina instead
WeatherShield,Weather Shield,Reduces the strength of most environmental effects.,,No additional effect when stacked.
Overkill,Overkill,First strikes will instantly kill enemies that don't give exp.,,Level required to kill enemies is reduced by 2 per badge equipped after the first.
SmartAmbush,Smart Ambush,First Strikes give you an additional action instead of an attack,,
AutoStrike,Auto Strike,All overworld encounters count as you first striking the enemy (unless the enemy first strikes you),,No additional effect when stacked.
InviteDanger,Invite Danger,"Normal enemy battles start as enemy first strikes, but you start with 2 focus (4 if you would normally first strike). Overrides effects that would normally prevent enemy first strikes.",,No additional effect when stacked.
ItemFinder,Item Finder,Greatly increases the chance that enemies will drop items. (Guaranteed if the encounter won't give xp),,Item drop rate can go above 100% which will make it possible to get multiple items from one encounter.
DodgeStep,Dodge Step,"Prevents you from getting hit by enemy first strikes. Allows you to use the action ""Easy Flee"" which guarantees escape but causes you to lose energy.",,No additional effect when stacked.
StealthStep,Stealth Step,Makes it harder for overworld enemies to target you by reducing their cone of vision.,,Has diminishing returns when stacked.
HasteStep,Haste Step,Move 20% faster in the overworld.,,
