Index,Name,Bio Text,Keru Text,Wilex Text,Luna Text
Stormkiller,Stormkiller,"The ancient cannon, now charged with an immense amount of energy. It takes some time to charge up, with the charging being interruptable. However, it can fortify itself, making it very difficult to prevent its ultimate attack from being used. The ultimate attack is unavoidable and impossible to survive, so interrupting its charge is crucial to defeating it.","Whatever you do, you must NOT let the cannon fire. Keep hitting it to reduce its level of charge. Its defense will increase every turn, so you need to defeat the cannon or the Stormtamer as fast as you can.","There's a lot of energy in that thing. Getting hit by it will probably kill us, so I need to stop it from firing by hitting it hard. Electric attacks won't work since it will just absorb them. Still, we're better off trying to take down the guy on top since the cannon has a lot more defense than him. We need to be fast about this fight, since this thing will keep getting more defense every turn, so eventually we won't be able to stop it from firing anymore.","It's bright and sparking, but that's probably a bad thing. I don't think I want this thing to fire on us, so I think we should keep hitting it so it won't attack."
TrainingDummy,Dummy,"An ordinary training dummy. This dummy has been around from the very beginning of the Tournament , and yet it appears almost completely undamaged.","It's a normal training dummy. I don't think you need to worry about breaking it, since the other Tournament fighters probably used it before.","Just a normal training dummy… It can survive anything we throw at it though. We don't need any training though, so we don't need this thing.","Did they have to give it a cute face like that? I feel kinda bad attacking it… Well it doesn't seem to mind, so I think it should be fine."
TrainingDummyBoss,Dummy?,"It seems that the dummy was inhabited by a magical spirit deep within it. The immense power of the spirit kept the dummy from being damaged, but the spirit would lay dormant until someone peered deep inside the dummy to awaken it.<line><line>The existence of this spirit raises an important question: Are there others like it hiding elsewhere in the world?","What!? How did I not see this power before? Okay, it looks like whatever possessed the dummy can't move around, so if you run away, it can't stop you. You need to get out of there, I don't see any way you could win this.","I knew there was something wrong with the face of this thing… It has more HP than anything else we've fought, so this is going to take a while. If we run away, it can't follow us, but I won't back down. We just have to fight like we've never fought before!","How strong is this guy? He has more HP than anyone else we've fought, so we'll have to fight harder than we've ever fought before! It can't catch us if we run away, but who knows what he could do if we left him alone?"
TournamentPawn,Boulder,"Boulder has always lived in the shadow of his older siblings, and so he has always wanted to prove himself stronger than them by carving his own path. However, his time in the tournament has been a long string of losses with only a small handful of victories, keeping him at the bottom of the rankings. His determination hasn't been shaken by this however, and so he is willing to give it his all to finally rise above the bottom and defeat someone.","Boulder's losing streak is impressive, as much as it is sad. You would think that a losing streak like that would humble him, but he is very stubborn and arrogant, unwilling to change his fighting style or improve.","He keeps using the same stomping attack over and over. No wonder he's losing every time. But I guess he has some pretty strong dedication, I probably would have dropped out of the tournament if I lost as much as he has.","Poor guy… Maybe we should let him win this one. No? Well, it doesn't look like he'll do anything other than stomp us, so this should be a simple fight."
TournamentKnight,Lance,"Lance is an eccentric fighter who relies a lot on his agility, being able to dodge a lot of his opponent's attacks, and also being able to attack very suddenly. While he may not be able to survive many hits against himself, a fluke upset against some of the higher ranking fighters has shown that his style isn't something that can be taken lightly.",KeruDefault_TournamentKnight,"It's hard to land a hit on him, so I'll have to pay attention to his stance. He gets a turn every time we move, so we should just keep trying to hit him as hard as we can.","So fast… He keeps zipping around to dodge my attacks. Maybe I can try to catch him off guard by attacking a certain way? He gets to attack every time we move, so we should just try to keep attacking him every turn."
TournamentBishopA,Ruby,"Ruby and Aqua are two of the more recently joined fighters in the tournament, deciding to join to follow in their big sister's footsteps. Ruby is focused on copying her sister's fighting style by being very aggressive with her attacks.",KeruDefault_TournamentBishopA,WilexDefault_TournamentBishopA,LunaDefault_TournamentBishopA
TournamentBishopB,Aqua,"Ruby and Aqua are two of the more recently joined fighters in the tournament, deciding to join to follow in their big sister's footsteps. Aqua is more reserved than her sister, and she has a more defensive fighting style as well.",KeruDefault_TournamentBishopB,WilexDefault_TournamentBishopB,LunaDefault_TournamentBishopB
TournamentRook,Stronghold,"Formerly one of Halberd's guards, Stronghold has decided to join the tournament for a change of pace.",KeruDefault_TournamentRook,WilexDefault_TournamentRook,LunaDefault_TournamentRook
TournamentQueenA,Amethyst,"Amethyst was a member of the first 2 person team allowed to compete in the Windspire Tournament. Her aggressive approach complimented her partner's more defensive approach, allowing the two of them to become champions for a short time.",KeruDefault_TournamentQueenA,WilexDefault_TournamentQueenA,LunaDefault_TournamentQueenA
TournamentQueenB,Glaive,"Glaive was a member of the first 2 person team allowed to compete in the Windspire Tournament. Some thought that this was due to corruption, as her brother is the mayor of Windspire. Yet this is likely not the case, as Halberd appears to have little to no interest in the tournament. She and her partner managed to rise all the way to the top, becoming champions for a short time, although they would lose their title shortly after gaining it.",KeruDefault_TournamentQueenB,WilexDefault_TournamentQueenB,LunaDefault_TournamentQueenB
TournamentKing,Crest,"The brother of the first champion, Crest has a fast and versatile attacking style that has led him to victory countless times, even against teams of fighters.",KeruDefault_TournamentKing,WilexDefault_TournamentKing,LunaDefault_TournamentKing
TournamentChampion,Summit,"The original champion of the Windspire Tournament. He left the tournament soon after the very first two person team entered the tournament.  From his perspective, allowing teams to compete would let weaklings take the title of Champion. His anger at this change reached its height when he was defeated by a team and lost his title for the first time after he got it. After winning his title back, he would disappear, taking the Champion Ribbon with him.","He's the original champion of the tournament. Even after all this time in hiding, he still hits extremely hard. You will need to watch his attacks closely, as they will do a lot more damage if you fail to block them. He also has the ability to block your attacks if you don't do them correctly. His fighting style is one where he often does massive attacks that make him need to recover after doing them, so you should use that downtime to prepare yourself for his next moves.","""Real champion""? Yeah, right. Like you're anything but a coward for hiding up here. He hits hard, but blocking works better than normal against his attacks. If I mess up my attacks, he'll block them completely too. After his bigger moves he'll take some time to recover, so I should watch out for those.","He looks a lot bigger than his brother, but he's been staying up here alone for a long time. I'll need to stay focused, since all his attacks will hurt a lot more if I don't block. He'll even block my attacks if I mess them up too. His bigger attacks make him tired when he does them, so maybe that's a good time to heal myself."
Slime,Slime,"A very common creature in the Gemstone Islands. They are naturally curious, so they will usually approach anyone who comes near them. Anything they're curious about ends up being covered in slime, since they often jump into things to get a better look at them.","Slimes are pretty weak, but they have two different ways of stomping. Their higher stomp will deal Water damage while their lower stomp does normal damage. They are somewhat weak to electrical attacks.","These little guys don't look very strong, but they can still stomp us pretty hard. Electricity is their weakness, so it's a good time for an Electro Stomp.",LunaDefault_Slime
Slimewalker,Slimewalker,"A Slime that has taken a form similar to the jellyfish in the Gemstone Islands. They can launch slime balls at their enemies, which will hit the one who will take more damage from it.","These slimes look like the jellyfish in the Gemstone Islands, and they sometimes try to mimic them. They can attack by slashing with a sharp tentacle or by shooting a slime ball. Their slime ball attack will target the one that will take the most damage from it, so defensive boosts may not be helpful here.","It looks like a jellyfish, but it's actually just another slime. They can slash us or shoot slime balls at us. They must be pretty smart, since they will shoot their slime at whichever of us will take the most damage.",LunaDefault_Slimewalker
Slimeworm,Slimeworm,"A strange creature that anchors itself in place to draw nutrients from the ground. They are almost never seen outside of their anchored state. They launch water bombs out of their tail in order to defend themselves. Their attacks are quite slow, requiring a full turn to prepare themselves to fire.","Slimeworms are large creatures that draw nutrients from the ground to empower themselves. They can charge to give themselves Focus and Absorb, and they will shoot large slime balls after charging. They also have thick skin that gives them high defense.","These worms have high defense, so I probably need to Focus to be able to hit them hard enough. It looks like these guys have the same idea, since they keep doing charge attacks.","They're too tall for me to stomp on, so I'll have to use my hammer on them. I might have to Power Smash them since their defense is pretty high."
Slimebloom,Slimebloom,"A strange flower-like creature made of slime. Similar to Slimeworms, they anchor themselves in place to draw nutrients from the ground. However, they have weaker attacks since they are much smaller. They will attack by throwing balls of water at their target or by firing a lightning bolt at them. Their tentacles are electrified, making direct contact with them dangerous. However, they are weak to Paralyze despite being covered in electricity.","They are not actually flowers, but they still draw energy from the ground. You should be careful to block their attacks, since they can paralyze you or put you to sleep. Their tentacles are also electrified, so you shouldn't stomp on them. Strangely, they are weak to being paralyzed despite being immune to electricity.","Weird looking flowers… Those tentacles are electrified so electrical attacks won't work on them. They can paralyze us if we're not careful, and they can also lob sleepy slime at us. We better get rid of them fast so they can't paralyze us or put us to sleep. They're weak to being paralyzed, so maybe we should give them a taste of their own medicine.","I can't tell if these are flowers or not… Getting a closer look is probably a bad idea since I'll get shocked by their tentacles. They can zap and paralyze us, and they can also lob slime balls at us to put us to sleep. We should get rid of them so they can't do that."
SirenFish,Siren Fish,"These strange fish are always covered in slime, which often forms into bubbles that they use to fly and attack. This is an adaptation to avoid predators, since there aren't any flying predators within the Gemstone Islands or the oceans they usually inhabit. They often sing songs, which can put their enemies to sleep or make their allies stronger.","These fish can fly using bubbles created from the slime on their skin. Their main attack is blowing sedative bubbles at you. They can also empower all their allies, so you should take care of them quickly. However, they can't boost their allies if they're grounded, so that is another way to stop them from boosting everyone.","They're covered in slime... Shouldn't they be called ""Slimefish""? The bubbles they blow can put us to sleep, and they can also sing a song that boosts all their allies. They can't sing while on the ground so I better get them down when I can.",LunaDefault_SirenFish
FalseDragonArm,Arm,"The arm of the False Dragon. When it gets destroyed, it will reform while the False Dragon is underwater, so the arm will be back when the False Dragon resurfaces.",KeruDefault_FalseDragonArm,WilexDefault_FalseDragonArm,LunaDefault_FalseDragonArm
FalseDragon,False Dragon,"A massive, strange creature made from an amalgamation of many Slimes and Jellyfish in the Gemstone Islands. It loosely resembles the Water Dragon Aquaria. The power of the Water Core held the amalgam together, and so the removal of the Water Core led to the False Dragon's dissolution.<line><line>The False Dragon's main method of attack is diving underwater and then creating massive waves when it resurfaces.",KeruDefault_FalseDragon,WilexDefault_FalseDragon,LunaDefault_FalseDragon
AmalgamLeftArm,Left Arm,BioDefault_AmalgamLeftArm,KeruDefault_AmalgamLeftArm,WilexDefault_AmalgamLeftArm,LunaDefault_AmalgamLeftArm
AmalgamRightArm,Right Arm,"The right arm of the Amalgam has many different elemental weaknesses, but it has stronger moves than the left arm.",KeruDefault_AmalgamRightArm,WilexDefault_AmalgamRightArm,LunaDefault_AmalgamRightArm
DiscordantAmalgam,Discordant Amalgam,"The noble goal of fostering cooperation between everyone on the Gemstone Islands was distorted into the creation of this amalgam. Its mind is filled with the contradicting thoughts and feelings of those it absorbed, with the only shared goal of growing the amalgam even further.",KeruDefault_AmalgamsWill,WilexDefault_AmalgamsWill,LunaDefault_AmalgamsWill
Blazecrest,Blazecrest,"Blazecrests are the strongest of the Flamecrests. They use their natural capabilities to fight enemies, seeing weapon users as weaklings who can't really fight. Their scales give them some defense, but they are weak to water attacks. The burning crests on their head and their burning clothing means that direct attacks will burn you. Blazecrests often see themselves as the ideal form of Flamecrests, since they are the strongest and have the strongest fire breath.<line><line>Their main attack is breathing a massive stream of fire to hit all their enemies at once. They can also roar at enemies to make them Berserk.","Blazecrests use their strong fire breath to hurt you, but they can also roar at you to make you Berserk. They have higher health than other Flamecrests, but they have the same water weakness most other Blazecrests have, so water is the best way to beat them.","Their heads are on fire, so obviously water attacks are the way to go here. I should beat them first because their fire breath is pretty strong, and their roar attack can make us Berserk.","These hotheads are always looking to pick a fight! A bit of water should help them cool off, so we should try using that kind of attack."
Embercrest,Embercrest,"Embercrests are not as strong as Blazecrests and have much weaker fire breath, only being able to produce smaller fireballs instead of a massive stream of flame. They have more defense than Blazecrests but they still have the same water weakness. Embercrests are the majority of the Flamecrest population, making up roughly 50% of them.<line><line>They tend to use a sword in addition to their fiery attacks to fight enemies. They usually slash twice with their sword attacks.","Embercrests have some defense and they use their swords to attack. They use a dual slash pattern to attack, but they can also shoot a fireball to hit someone with Fire damage. Embercrests have the same water weakness most other Flamecrests have, so try using water on them if you can.","Two swords… Don't they know one is enough? They can use both swords to attack or they can shoot fireballs at us. That armor they're wearing gives them some defense too. Water attacks are a good idea, but poison also works on them.",LunaDefault_Embercrest
Ashcrest,Ashcrest,"Ashcrests are the weakest of the Flamecrests. Unlike other Flamecrests, they are not weak to water, but they are slightly weak to fire attacks instead. Ashcrests are often looked down upon by other Flamecrests because they can't breathe fire at all, and often times their crests aren't even on fire.<line><line>They tend to rely on bomb attacks since they are quite weak physically.","Ashcrests have the lowest health and defense of Flamecrests, but they don't have the same water weakness of other Flamecrests. They are actually slightly weak to fire damage though. They use shock bombs and water bombs to attack instead of attacking directly.","Sneaky little guys… They can't breathe fire, but the bombs they throw are pretty annoying. Each bomb can only hit one of us, with one bomb being a water bomb and another bomb being a shock bomb. They're not weak to water, but fire works fine against them.",LunaDefault_Ashcrest
Flametongue,Flametongue,"Flametongues are an all female species of scaly mammals with very long tongues. Somehow, their tongues are longer than their bodies. They stick out their tongues to burn enemies from a distance.<line><line>Flametongues are found in small numbers all around the Infernal Caldera, but the largest group of them lives on Silver Island.","Flametongues are actually mammals, despite how they're covered in scales. They can burn both of you with their long tongues. Their thick scales give them a lot of defense and makes them almost immune to fire attacks. Electric attacks are a good way of beating them.",Their tongues are really long… How do they fit in their bodies? They attack by licking both of us at the same time to burn us. I'll need to use electrical attacks to get through their thick scales. Paralyzing them also seems like a good idea too.,"These girls are tough, even if they don't have as much health as everything else around here, and that's because of their big scales. They attack by licking us with their long burning tongues. Wilex might have an easier time dealing with them since he has some Electric attacks he can use here."
Heatwing,Heatwing,"Heatwings are fiercely territorial, so they will attack anyone unfamiliar who intrudes on their territory. Their main attacks are swooping down on targets or flapping their wings to burn a large area with their burning wings. Like  many other fiery creatures, water attacks are especially effective against them.","Heatwings are flying reptiles with burning wings. Like many other burning creatures, they are weak to water damage, but you may need to bring them down to use water against them. They can flap their wings to spread fire to hit both of you. Their other method of attack is to swoop down at a target twice.","Another fiery enemy… Water attacks are a good idea, but I'll have to get them down to hit them with one. The fiery wind they can blow with their wings isn't that strong, but they can also swoop down to hit us twice.",LunaDefault_Heatwing
Lavaswimmer,Lavaswimmer,"These large reptiles have perpetually burning scales on their backs that make it dangerous to jump on them. Domesticated Lavaswimmers are often used as a source of leather, meat and eggs. However, wild Lavaswimmers often have stronger flames on their backs, which are better suited for making the infinitely burning leather that inhabitants of the Caldera wear.","Lavaswimmers are covered in burning scales that make it dangerous to come into contact with them. This is their main defense mechanism, as their attacks are somewhat weak. They can bite you and they can also shoot fireballs at you. They aren't weak to water, but electric attacks are very effective against them, so that is a good way to beat them.","They have pretty weak attacks, but they can shoot fireballs at us. They have burning skin, which gives them a little bit of defense and makes them immune to fire. They're weak to electricity and paralysis, so that might be a way to beat them faster.",LunaDefault_Lavaswimmer
LavaWyvern,Lava Wyvern,"A large beast that came from a deep part of the Infernal Caldera. The secrets to taming beasts like this were known only to the fallen House Roseeye.<line><line>Lepidol relies on this beast to fight for him. The bond between them appeared quite strong, until the beast left him behind after it was defeated.",KeruDefault_LavaWyvern,WilexDefault_LavaWyvern,LunaDefault_LavaWyvern
MetalWyvern,Metal Wyvern,The bright blue flame is created by burning metal compounds on its back,KeruDefault_MetalWyvern,WilexDefault_MetalWyvern,LunaDefault_MetalWyvern
EyeSpore,Eye Spore,"Eye Spores are small fungal spores that can move on their own that can only grow in the darkness of the Shrouded Valley. These spores can infect targets to turn them into spore zombies. However, outsiders are usually immune to the spores, and the spore infection can only take hold if the target actually dies, so they will try their best to focus on vulnerable targets<line><line>Eye spores attack by shooting small spore balls at targets. They are weak to Fire and Earth damage.","If you're feeling like you're being watched down here, there's a good chance it's one of these creatures. They focus most of their attacks on the enemy with the lowest health, and their attacks get stronger when you have less health. Make sure you keep your health as high as possible. Fire and Earth are their main weaknesses so you should use those damage types to beat them quickly.","I don't like how they're looking at me… They will try to hit whoever has the lowest health, and their attacks are a lot stronger when we have less health. We should get rid of them before our hp gets too low. Fire attacks are one of their weaknesses, so that's what I should do to beat them.","They're so creepy! The spore gunk they shoot will hurt a lot more when we have less health, so I should make sure to keep our health up. I can also use Earth damage to get rid of them fast."
SpikeShroom,Spike Shroom,"These mushrooms are balls of very sharp spikes, and their spikes can inflict poison on attackers. Their spikes are very stiff, giving them high defense. Spike Shrooms will try to poke creatures they sense in order to spread their spores. They are weak to Electric and Earth damage.","Spike Shrooms are covered in spikes, like what the name suggests. You should avoid being hit by their spikes, since all of them are filled with poison. Their spikes give them high defense, but Electric or Earth attacks will get rid of them quickly.","All those spikes are make it hard to get a good hit on them, but electricity will still work pretty well. I won't get poked by the spikes if I Electro Stomp them, so that's probably the way to beat these things.",So sharp and pointy… I should get rid of them fast so I don't get poked. They look like they can poison us too. I feel like a Breaker Smash will do a good job at that.
Shrouder,Shrouder,"A spore creature that has absorbed some of the illusory power of the Shrouded Valley. This allows them to hide their allies from attacks. These creatures are mostly hollow on the inside, making them buoyant enough to fly.<line><line>They attack by spreading large clouds of spores to weaken enemies. They can only shroud their allies while airborne, so grounding them is a good way to prevent that.","These are one of the more insidious creatures of the Shrouded Valley. Shrouders can hide their allies from your attacks, and they can blow clouds of spores that make it harder to use skills. Make sure you remove them first or else you'll be fighting an uphill battle.",Shrouders can hide our enemies from attacks and blow dark clouds that make it harder for us to move. I better get rid of it first so it won't slow us down.,LunaDefault_Shrouder
HoarderFly,Hoarder Fly,"These creatures can convert the dark energy of the Valley into healing light, but they hoard this energy instead of using it for the most part. Their bites actually heal their targets by a small amount, but their bites also inject strong venom as well.<line><line>Hoarder Flies are commonly hunted for food as they are one of the few non-fungal creatures in the Shrouded Valley.","Hoarder Flies have healing magic, but they almost never use it willingly. Their bites will heal you for a small amount, but their bites have some venom that will poison you. They can also swoop down on you multiple times to do damage normally.","Apparently they have healing abilities, but they usually keep it all to themselves, which is pretty good for us. They will fight pretty viciously to defend themselves though. Their bites heal us a tiny amount but also poisons us, and they can also swoop down on us multiple times. We should get rid of it first so it can't poison us.",LunaDefault_HoarderFly
